{"schema_version": "0.1.0", "protocol_id": "Chest pain", "action": "ask_question", "question_id": "ID_7e00ff7f-27c4-458b-b953-2cc9dcdef191", "option_ids": ["ID_85d07260-ab02-495a-9b5d-c4a81c1ab528", "ID_63bfc1ab-08e2-430a-8641-3b9965866746", "ID_eb2cd4bb-d56a-4cb4-aa06-e76ef12b7cb1", "ID_e90dcb3a-45f6-486d-90ca-49c48b24442f", "ID_9ccc2f2e-e17f-4556-890c-938830828a1a", "ID_798d4a21-618e-4a70-96e9-732e86a3298b", "ID_7e00ff7f-27c4-458b-b953-2cc9dcdef191"]}
