{
  "action": "ask_question",
  "option_ids": [
    "ID_d1f66d19-85c6-4939-bd70-0c32e4dfeb0e",
    "ID_ccd281a7-cc17-4e00-8f08-89a288a70f92",
    "ID_2aee2f3d-6787-488a-977e-abe4144dc0e6",
    "ID_383a59a3-8a12-4098-b8b9-124eea1cd8bb",
    "ID_ced87aad-6cb8-48c8-99c0-23dbb8338a19",
    "ID_d54ed407-f2e6-414b-bd3a-68d11aad4643",
    "ID_39d597b5-ee0d-4b5b-8aef-fdefadcad337",
    "ID_be752347-0d0e-4b9d-915c-fd9279303290",
    "ID_69190530-3dcd-4cc2-aa26-400d18e7de0d",
    "ID_cc15473e-1761-4958-9d32-6b7b27ddc48d"
  ],
  "protocol_id": "Chest pain",
  "question_id": "ID_7d090a35-4685-4063-9101-f5ca9dcdb11c",
  "schema_version": "0.1.0"
}
