{"schema_version": "0.1.0", "protocol_id": "Chest pain", "action": "ask_question", "question_id": "ID_d693c0a4-8021-4c2c-9b3c-fe2ca352cf6a", "option_ids": ["ID_b6ccd295-a061-4974-9d97-8983588424c7", "ID_1c51bdc9-0069-46e9-9e7e-6bff95f8eacf", "ID_96949bd1-cf34-4d25-9d65-d0c6bd60cf56", "ID_eca8a1f2-e03c-459f-99a0-85bfd5547764"] }
